{
  "notes": [
    "Settled policy. Budgets are soft: exceeding one checkpoints the issue for explicit reconciliation.",
    "Batch-3 observed maxima: implement 13.3M input / 75k output / 125 tool calls / 2793 s; review 2.3M input / 16k output / 48 tool calls / 575 s.",
    "implement 15M/250k/250 and 5400 s leave headroom above those maxima; repair is about a third of implement. The implement output budget was 150k until W-263: legitimate implement phases wrote 166,709 (W-245, ready) and 183,191 (W-256) output tokens. The repair output budget was 50k until W-440: five repairs of the fifteen §2.10 batches (s210-spec-20261006, s210-amend-20261006, s210-impl-h-20261009) finished ready with 66,138 to 134,258 output tokens (W-401, W-356, W-331, W-328, W-357), each rewriting long specification pages as its findings asked, and each stopped its batch at a budget checkpoint. 150k is the largest of them plus about a tenth.",
    "review 5M/40k/120 matches the last working batch-3 budget; 1800 s is about three times the slowest observed review.",
    "max_repairs 2 is the engine's upper bound, shared across resumes and profiles; each check may run 1800 s.",
    "bounded_sessions holds the thresholds; a batch turns the behavior on with context_controls.bounded_sessions (off by default). A worker session whose cumulative input reached 5M tokens, or the first repair after implement, continues in a fresh session seeded with a handoff file (at most 12,000 bytes) instead of resuming the long one. 5M is where batch-3 implement sessions (the W-170 resume, W-171, W-172) approached the model context window.",
    "Cached input: the input_tokens budget judges uncached input (input_tokens minus cached_input_tokens) whenever the backend reports a cached figure, whatever the phase returned (ready or blocked); without a cached figure it judges total input. A resumed long session rereads its context as cached input on each turn; W-249 implement read 22.2M input of which 21.8M was cached, W-233 repair 6.25M of which 6.21M, and W-245 (ready), W-255 and W-256 (both blocked) implement 20.2M, 15.9M and 31.1M with at most 0.41M uncached (W-263). When total input is over the limit but uncached input is not, phase-usage.json records a budget_note. Uncached input, output or tool calls over budget, or a missing figure, still stop; recover budget --input-tokens sets the uncached limit.",
    "max_timeout_seconds 14400 is the largest phase timeout a batch may set for a named issue (batch phase_overrides, for example a repair that takes browser screenshots: W-249 hit 5400 s).",
    "max_check_timeout_seconds 7200 is the largest timeout a project may give one check (check timeout_seconds); a check without one keeps check_timeout_seconds. W-274's validation module needed about 2217 s at one thread and had to be split by test selection under the fixed 1800 s (W-282).",
    "compact_token_limit is unset for every phase. A phase may set it, and a batch may set context_controls.compact_token_limit for all phases; the runner then passes -c model_auto_compact_token_limit=<N> (a Codex CLI 0.154.0 config key) on fresh and resumed calls."
  ],
  "phases": {
    "implement": {
      "budget": {
        "input_tokens": 15000000,
        "output_tokens": 250000,
        "tool_calls": 250
      },
      "timeout_seconds": 5400
    },
    "repair": {
      "budget": {
        "input_tokens": 5000000,
        "output_tokens": 150000,
        "tool_calls": 100
      },
      "timeout_seconds": 5400
    },
    "review": {
      "budget": {
        "input_tokens": 5000000,
        "output_tokens": 40000,
        "tool_calls": 120
      },
      "timeout_seconds": 1800
    }
  },
  "max_repairs": 2,
  "check_timeout_seconds": 1800,
  "max_check_timeout_seconds": 7200,
  "max_timeout_seconds": 14400,
  "bounded_sessions": {
    "input_threshold_tokens": 5000000,
    "handoff_after_implement": true,
    "max_handoff_bytes": 12000
  }
}
